ELEMENT_ID,GRAND_GROUPE,Nom_francais,Autres_noms_francais,Nom_anglais,Autres_noms_anglais,Nom_scientifique,Anciens_noms_scientifiques,Commentaires,Origine,Regularite,Degre_de_certitude,Statuts_des_populations,CLASSE,ORDRE,FAMILLE,GENRE,ESPECE,SOUS_ESPECE_POP,Rang_S,STATUT_LEMV,COMPETENCE_PRINCIPALE
440,Oiseaux,Plectrophane des neiges,plectrophane des neiges; bruant de neige; ortolan d'Amérique; ortolan de neige,Snow Bunting,Snowflake; Snowbird; Arctic Sparrow; Little White Bird,Plectrophenax nivalis,,,Indigène,Régulier,Confirmé,Reproducteur,Aves,Passeriformes,Calcariidae,Plectrophenax,nivalis,,S4S5B,Non suivie,Environnement et Changement climatique Canada
441,Oiseaux,Goglu des prés,goglu; goglu bobolink; dolychonyx oryzivore; dolychonix,Bobolink,Butter Bird; October Pink; Bob; Chatter Bird,Dolichonyx oryzivorus,,,Indigène,Régulier,Confirmé,Reproducteur,Aves,Passeriformes,Icteridae,Dolichonyx,oryzivorus,,S3B,Vulnérable,Environnement et Changement climatique Canada
442,Oiseaux,Carouge à épaulettes,troupiale à épaulettes rouges; commandeur; étourneau aux ailes rouges; caporal,Red-winged Blackbird,Rice Bird; Red-shouldered Blackbird; Eastern Red-winged Blackbird; Field Officer,Agelaius phoeniceus,,,Indigène,Régulier,Confirmé,Reproducteur,Aves,Passeriformes,Icteridae,Agelaius,phoeniceus,,S5B,Non suivie,Québec
443,Oiseaux,Sturnelle des prés,stournelle à cou noir; stournelle des prés; stournelle; stournelle orientale,Eastern Meadowlark,Common Meadowlark; Large Lark; Eastern Meadowlark,Sturnella magna,,,Indigène,Régulier,Confirmé,Reproducteur,Aves,Passeriformes,Icteridae,Sturnella,magna,,S3B,Candidate,Environnement et Changement climatique Canada
444,Oiseaux,Sturnelle de l'Ouest,étourneau des prés américain; stournelle; stournelle à cou noir; étourneau des prés de l'Ouest,Western Meadowlark,King Syble-a-bon; Prairie Lark,Sturnella neglecta,,,Indigène,Accidentel/non régulier,Confirmé,Migrateur,Aves,Passeriformes,Icteridae,Sturnella,neglecta,,SNA,Non suivie,Environnement et Changement climatique Canada
445,Oiseaux,Carouge à tête jaune,étourneau à tête jaune; troupiale à tête jaune; merle à tête jaune,Yellow-headed Blackbird,Californian Blackbird; Yellowshammer; Yellowhead; Yellow Headed Blackbird,Xanthocephalus xanthocephalus,,,Indigène,Régulier,Confirmé,Migrateur,Aves,Passeriformes,Icteridae,Xanthocephalus,xanthocephalus,,SNA,Non suivie,Québec
446,Oiseaux,Quiscale rouilleux,mainate rouilleux; molothre de la Californie; rusty grackle; mainate couleur de rouille,Rusty Blackbird,Blackbird; Black Robin; Cattle Blackbird; Rusty grackle,Euphagus carolinus,,,Indigène,Régulier,Confirmé,Reproducteur,Aves,Passeriformes,Icteridae,Euphagus,carolinus,,S3S4B,Susceptible,Québec
447,Oiseaux,Quiscale de Brewer,mainate de Brewer; mainate à tête pourprée; quiscale à tête pourprée,Brewer's Blackbird,Satin Bird; Starling,Euphagus cyanocephalus,,,Indigène,Accidentel/non régulier,Confirmé,Migrateur,Aves,Passeriformes,Icteridae,Euphagus,cyanocephalus,,SNA,Non suivie,Québec
449,Oiseaux,Quiscale bronzé,mainate bronzé; quiscale commun; ménate bronzé; ménate,Common Grackle,Big Blackbird; Black Robin; Purple Jack-Daw; Stone's Purple Grackle,Quiscalus quiscula,,,Indigène,Régulier,Confirmé,Reproducteur,Aves,Passeriformes,Icteridae,Quiscalus,quiscula,,S5B,Non suivie,Québec
450,Oiseaux,Vacher à tête brune,molothre à tête brune; molothre noir; molothre; molothre des troupeaux,Brown-headed Cowbird,Eastern Cowbird; Nevada Cowbird; Common Cowbird; Black Robin,Molothrus ater,,,Indigène,Régulier,Confirmé,Reproducteur,Aves,Passeriformes,Icteridae,Molothrus,ater,,S4B,Non suivie,Québec
451,Oiseaux,Oriole des vergers,troupiale des vergers; baltimore bâtard,Orchard Oriole,Bastard Baltimore,Icterus spurius,,,Indigène,Régulier,Confirmé,Reproducteur,Aves,Passeriformes,Icteridae,Icterus,spurius,,S3B,Non suivie,Environnement et Changement climatique Canada
452,Oiseaux,Oriole de Baltimore,oriole du Nord; oriole orangé; loriot du Nord; loriot d'Altamira,Baltimore Oriole,Northern oriole,Icterus galbula,,,Indigène,Régulier,Confirmé,Reproducteur,Aves,Passeriformes,Icteridae,Icterus,galbula,,S4B,Non suivie,Environnement et Changement climatique Canada
453,Oiseaux,Pinson du Nord,,Brambling,,Fringilla montifringilla,,,Indigène,Accidentel/non régulier,Confirmé,Migrateur,Aves,Passeriformes,Fringillidae,Fringilla,montifringilla,,SNA,Non suivie,Environnement et Changement climatique Canada
454,Oiseaux,Durbec des sapins,dur-bec des sapins; dur-bec des pins; dur-ordinaire; bouvreuil du Canada,Pine Grosbeak,,Pinicola enucleator,,,Indigène,Régulier,Confirmé,Toute l'année,Aves,Passeriformes,Fringillidae,Pinicola,enucleator,,S4,Non suivie,Environnement et Changement climatique Canada
455,Oiseaux,Roselin pourpré,roselin pourpre; oiseau rouge; mordeux rouge; pinson rouge,Purple Finch,Eastern Purple Finch; Grey Linnet; Linnet; Pine Finch,Haemorhous purpureus,,,Indigène,Régulier,Confirmé,Reproducteur,Aves,Passeriformes,Fringillidae,Haemorhous,purpureus,,S5B,Non suivie,Environnement et Changement climatique Canada
456,Oiseaux,Roselin familier,roselin du Mexique; bouvreuil écarlate,House Finch,,Haemorhous mexicanus,,,Exotique,Régulier,Confirmé,Toute l'année,Aves,Passeriformes,Fringillidae,Haemorhous,mexicanus,,SNA,Non suivie,Environnement et Changement climatique Canada
457,Oiseaux,Bec-croisé des sapins,bec-croisé rouge; bec-croisé ordinaire; bec-croisé; bec-croisé commun,Red Crossbill,Wild Canary Eastern Red Crossbill; Newfoundland Crossbill; Sitka Red Crossbill,Loxia curvirostra,,,Indigène,Régulier,Confirmé,Toute l'année,Aves,Passeriformes,Fringillidae,Loxia,curvirostra,,S4,Non suivie,Environnement et Changement climatique Canada
458,Oiseaux,Bec-croisé bifascié,bec-croisé à ailes blanches; bec-croisé leucoptère; bec-croisé,White-winged Crossbill,Two-barred Crossbill; Cross Billed Linnet; Spruce Bird; Crossbeak Linnet,Loxia leucoptera,,,Indigène,Régulier,Confirmé,Toute l'année,Aves,Passeriformes,Fringillidae,Loxia,leucoptera,,S5,Non suivie,Environnement et Changement climatique Canada
459,Oiseaux,Sizerin flammé,sizerin blanchâtre; sizerin à tête rouge; sizerin boréal; sizerin cabaret; linotte,Redpoll,Redpoll Linnet; Common Redpoll; Hoary Redpoll,Acanthis flammea,Acanthis hornemanni; Carduelis flammea; Carduelis hornemanni,,Indigène,Régulier,Confirmé,Toute l'année,Aves,Passeriformes,Fringillidae,Acanthis,flammea,,S5,Non suivie,Environnement et Changement climatique Canada
461,Oiseaux,Tarin des pins,chardonneret des pins; chardonneret des pins; tarin des aulnes; serinette,Pine Siskin,Little Canary,Spinus pinus,Carduelis pinus,,Indigène,Régulier,Confirmé,Toute l'année,Aves,Passeriformes,Fringillidae,Spinus,pinus,,S5,Non suivie,Environnement et Changement climatique Canada
462,Oiseaux,Chardonneret jaune,chardonneret jaune américain; chardonneret d'Amérique; astragaline dorée; tarin d'Amérique,American Goldfinch,Common Goldfinch; Wild Canary; Eastern Goldfinch,Spinus tristis,Carduelis tristis,,Indigène,Régulier,Confirmé,Reproducteur,Aves,Passeriformes,Fringillidae,Spinus,tristis,,S5B,Non suivie,Environnement et Changement climatique Canada
465,Oiseaux,Gros-bec errant,gros-bec à couronne noire; gros-bec crépusculaire; gros-bec vespéral; gros-bec de soirée,Evening Grosbeak,Winter Canary,Coccothraustes vespertinus,,,Indigène,Régulier,Confirmé,Toute l'année,Aves,Passeriformes,Fringillidae,Coccothraustes,vespertinus,,S4,Non suivie,Environnement et Changement climatique Canada
466,Oiseaux,Moineau domestique,moineau commun; moineau franc; moineau d'Europe; pierrot,House Sparrow,English Sparrow; Bull Sparrow; Grey Bird; Hedge Sparrow,Passer domesticus,,,Exotique,Régulier,Confirmé,Toute l'année,Aves,Passeriformes,Passeridae,Passer,domesticus,,SNA,Non suivie,Québec
636,Poissons,Achigan à grande bouche,achigan à grande bouche du Nord,Largemouth Bass,Black Bass; Largemouth Black Bass; Green Bass; Northern Largemouth Bass,Micropterus nigricans,Micropterus salmoides,,Indigène,Régulier,Confirmé,Toute l'année,Actinopterygii,Perciformes,Centrarchidae,Micropterus,nigricans,,S4S5,Non suivie,Déléguée au Québec
635,Poissons,Achigan à petite bouche,achigan à petite bouche du Nord; achigan noir; achigan vert,Smallmouth Bass,Northern Smallmouth Bass; Smallmouth Black,Micropterus dolomieu,Micropterus dolomieui,,Indigène,Régulier,Confirmé,Toute l'année,Actinopterygii,Perciformes,Centrarchidae,Micropterus,dolomieu,,S5,Non suivie,Déléguée au Québec
495,Poissons,Agone atlantique,,Atlantic Poacher,Atlantic Sea Poacher; Northern Alligatorfish; Sea Poacher,Leptagonus decagonus,Agonus decagonus,,Indigène,Régulier,Confirmé,Toute l'année,Actinopterygii,Perciformes,Agonidae,Leptagonus,decagonus,,S4,Non suivie,Pêches et Océans Canada
606,Poissons,Aiglefin,,Haddock,Eglefin,Melanogrammus aeglefinus,,,Indigène,Régulier,Confirmé,Toute l'année,Actinopterygii,Gadiformes,Gadidae,Melanogrammus,aeglefinus,,SNA,Non suivie,Pêches et Océans Canada
709,Poissons,Aiguillat commun,,Spiny Dogfish,,Squalus acanthias,,,Indigène,Régulier,Confirmé,Toute l'année,Chondrichthyes,Squaliformes,Squalidae,Squalus,acanthias,,S4,Non suivie,Pêches et Océans Canada
707,Poissons,Aiguillat noir,,Black Dogfish,Combtooth Dogfish,Centroscyllium fabricii,,,Indigène,Régulier,Confirmé,Toute l'année,Chondrichthyes,Squaliformes,Etmopteridae,Centroscyllium,fabricii,,S5,Non suivie,Pêches et Océans Canada
523,Poissons,Alose à gésier,alose à gésier de l'Est,Gizzard Shad,American Gizzard Shad; Eastern Grizzard Shad; Hickory Shad; Sawbelly,Dorosoma cepedianum,,La migration de cette espèce à partir du Mississipi a été rendue possible grâce à l'établissement des canaux d'eau.,Indigène,Régulier,Confirmé,Toute l'année,Actinopterygii,Clupeiformes,Dorosomatidae,Dorosoma,cepedianum,,S3S4,Non suivie,Déléguée au Québec
520,Poissons,Alose d'été,,Blueback Herring,,Alosa aestivalis,,"L'espèce est présente dans le Richelieu, originant de la partie américaine du Lac Champlain, mais l'espèce ne fut morphologiquement reconnue que tardivement. Observée dans les Grands Lacs en 1995 pour la première fois.",Exotique,Régulier,Confirmé,Inconnu/non déterminé,Actinopterygii,Clupeiformes,Alosidae,Alosa,aestivalis,,SNA,Non suivie,Déléguée au Québec
522,Poissons,Alose savoureuse,alose canadienne; alose; alose d'Amérique,American Shad,Shad; Common Shad; Atlantic Shad; White Shad,Alosa sapidissima,,,Indigène,Régulier,Confirmé,Toute l'année,Actinopterygii,Clupeiformes,Alosidae,Alosa,sapidissima,,S3,Vulnérable,Déléguée au Québec
519,Poissons,Anguille d'Amérique,anguille commune; ga-da,American Eel,Eel; Elver; Green Eel; Black Eel,Anguilla rostrata,,,Indigène,Régulier,Confirmé,Toute l'année,Actinopterygii,Anguilliformes,Anguillidae,Anguilla,rostrata,,S3,Susceptible,Déléguée au Québec
30266,Poissons,Anguille égorgée bécue,,Kaup's Arrowtooth Eel,Gulf Cutthroat Eel,Synaphobranchus kaupii,,,Indigène,Régulier,Confirmé,Non reproducteur,Actinopterygii,Anguilliformes,Synaphobranchidae,Synaphobranchus,kaupii,,S4,Non suivie,Pêches et Océans Canada
30244,Poissons,Avocette ruban,,Slender Snipe Eel,,Nemichthys scolopaceus,,,Indigène,Régulier,Confirmé,Non reproducteur,Actinopterygii,Anguilliformes,Nemichthyidae,Nemichthys,scolopaceus,,S4,Non suivie,Pêches et Océans Canada
30249,Poissons,Balaou,,Atlantic Saury,,Scomberesox saurus,,,Indigène,Régulier,Confirmé,Non reproducteur,Actinopterygii,Beloniformes,Scomberesocidae,Scomberesox,saurus,,S4,Non suivie,Pêches et Océans Canada
629,Poissons,Bar blanc,achigan blanc; bar malfait,White Bass,Silver Bass; White Lake-bass,Morone chrysops,,,Indigène,Régulier,Confirmé,Toute l'année,Actinopterygii,Perciformes,Moronidae,Morone,chrysops,,S3,Non suivie,Déléguée au Québec
14475,Poissons,Bar rayé,bar d'Amérique; bar de mer,Striped Bass,Rockfish; Striper Bass; Rockfish Striper; Linesides,Morone saxatilis,,Le fleuve Saint-Laurent abritait une population distincte de bars rayés laquelle est disparue à la fin des années 1960. La population du fleuve Saint-Laurent actuelle a été réintroduite à partir d'individus de la population du sud du golfe du Saint-Laurent.,Indigène,Régulier,Confirmé,Toute l'année,Actinopterygii,Perciformes,Moronidae,Morone,saxatilis,,SNA,Non suivie,Déléguée au Québec
597,Poissons,Barbotte brune,barbotte brune du Nord,Brown Bullhead,Northern Brown Bullhead; Brown Catfish; Mudcat; Hornpout,Ameiurus nebulosus,Ictalurus nebulosus,,Indigène,Régulier,Confirmé,Toute l'année,Actinopterygii,Siluriformes,Ictaluridae,Ameiurus,nebulosus,,S5,Non suivie,Déléguée au Québec
596,Poissons,Barbotte jaune,,Yellow Bullhead,Northern Yellow Bullhead; Yellow Catfish; Bullhead,Ameiurus natalis,Ictalurus natalis,,Indigène,Régulier,Confirmé,Toute l'année,Actinopterygii,Siluriformes,Ictaluridae,Ameiurus,natalis,,S3,Susceptible,Déléguée au Québec
591,Poissons,Barbue de rivière,barbue du nord; barbue,Channel Catfish,Channel Cat; Spotted Catfish; Great Lakes Catfish; Northern Catfish,Ictalurus punctatus,,,Indigène,Régulier,Confirmé,Toute l'année,Actinopterygii,Siluriformes,Ictaluridae,Ictalurus,punctatus,,S5,Non suivie,Déléguée au Québec
628,Poissons,Baret,bar-perche; perche blanche; petit bar; gatte,White Perch,Narrow-mouthed Bass; Silver Perch; Sea Perch; Little White Basse,Morone americana,,Espèce originaire des côtes Atlantique Nord et qui a migré via l'établissement des canaux d'eau.,Indigène,Régulier,Confirmé,Toute l'année,Actinopterygii,Perciformes,Moronidae,Morone,americana,,S4,Non suivie,Déléguée au Québec
698,Poissons,Baudroie d'Amérique,lotte; baudroie; diable de mer; poisson-pêcheur,Goosefish,American Anger; American Monkfish; American Goosefish; All-mouth,Lophius americanus,,,Indigène,Régulier,Confirmé,Toute l'année,Actinopterygii,Lophiiformes,Lophiidae,Lophius,americanus,,S5,Non suivie,Pêches et Océans Canada
31162,Poissons,Beauclaire de roche,Soleil,Glasseye,,Heteropriacanthus cruentatus,,,Indigène,Accidentel/Non régulier,Confirmé,Migrateur,Actinopterygii,Perciformes,Priacanthidae,Heteropriacanthus,cruentatus,,SNA,Non suivie,
30284,Poissons,Béryx commun,,Imperador,,Beryx decadactylus,,,Indigène,Accidentel/Non régulier,Confirmé,Migrateur,Actinopterygii,Beryciformes,Berycidae,Beryx,decadactylus,,SNA,Non suivie,
550,Poissons,Brochet d'Amérique,,Redfin Pickerel,Banded Pickrel; Trout Pickerel; Bulldog Pickerel; Red-fined Pike,Esox americanus americanus,,,Indigène,Régulier,Confirmé,Toute l'année,Actinopterygii,Esociformes,Esocidae,Esox,americanus,americanus,S3,Retirée,Déléguée au Québec
554,Poissons,Brochet maillé,,Chain Pickerel,Eastern Pickerel; Reticulated Pickerel; Federation Pickerel; Black Chain Pike,Esox niger,,,Indigène,Régulier,Confirmé,Toute l'année,Actinopterygii,Esociformes,Esocidae,Esox,niger,,S3,Susceptible,Déléguée au Québec
551,Poissons,Brochet vermiculé,brochet d'herbe; brochet de vase; brochet de fossé,Grass Pickerel,Western Grass Pickerel; Mud Pickerel; Little Pickerel; Central Redfin Pickerel,Esox americanus vermiculatus,,,Indigène,Régulier,Confirmé,Toute l'année,Actinopterygii,Esociformes,Esocidae,Esox,americanus,vermiculatus,S2,Vulnérable,Déléguée au Québec
602,Poissons,Brosme,,Cusk,Tusk; Torsk,Brosme brosme,,,Indigène,Régulier,Jamais été présente,Toute l'année,Actinopterygii,Gadiformes,Gadidae,Brosme,brosme,,SNA,Susceptible,Pêches et Océans Canada
547,Poissons,Capelan,,Capelin,Caplin; Lodde; Whitefish; Angmagssat,Mallotus villosus,,,Indigène,Régulier,Confirmé,Toute l'année,Actinopterygii,Osmeriformes,Osmeridae,Mallotus,villosus,,S4,Non suivie,Pêches et Océans Canada
620,Poissons,Capucette,,Atlantic Silverside,,Menidia menidia,,,Indigène,Régulier,Confirmé,Toute l'année,Actinopterygii,Atheriniformes,Atherinopsidae,Menidia,menidia,,S5,Non suivie,Pêches et Océans Canada
558,Poissons,Carpe commune,carpe; carpe européenne; carpe allemande; koi; carpe koi; nishikigoi,Common Carp,Carp; German Carp; European Carp; Mirror Carp; Koi; Nishikigoi,Cyprinus carpio,,"Le nom commun français diffère de celui utilisé dans la publication ""American Fisheries Society (2013) Common and Scientific Names of Fishes from the United States, Canada, and Mexico, 7th edition"", mais sera révisé lors de la prochaine publication.",Exotique,Régulier,Confirmé,Toute l'année,Actinopterygii,Cypriniformes,Cyprinidae,Cyprinus,carpio,,SNA,Non suivie,Déléguée au Québec
17712,Poissons,Carpe de roseau,,Grass Carp,,Ctenopharyngodon idella,,,Exotique,Régulier,Confirmé,Toute l'année,Actinopterygii,Cypriniformes,Xenocyprididae,Ctenopharyngodon,idella,,SNA,Non suivie,Déléguée au Québec
482,Poissons,Chaboisseau à dix-huit épines,,Longhorn Sculpin,Long-spined Sculpin; Hacklehead; Toadfish; Bullhead,Myoxocephalus octodecemspinosus,,,Indigène,Régulier,Confirmé,Toute l'année,Actinopterygii,Perciformes,Psychrolutidae,Myoxocephalus,octodecemspinosus,,S5,Non suivie,Pêches et Océans Canada
484,Poissons,Chaboisseau à épines courtes,crapaud de mer à courtes épines,Shorthorn Sculpin,Daddy Sculpin; Greenland Sculpin,Myoxocephalus scorpius,,,Indigène,Régulier,Confirmé,Toute l'année,Actinopterygii,Perciformes,Psychrolutidae,Myoxocephalus,scorpius,,S5,Non suivie,Pêches et Océans Canada
479,Poissons,Chaboisseau à quatre cornes,,Fourhorn Sculpin,Scorpion Fish; Sculpin,Myoxocephalus quadricornis,,,Indigène,Régulier,Confirmé,Toute l'année,Actinopterygii,Perciformes,Psychrolutidae,Myoxocephalus,quadricornis,,S4,Susceptible,Déléguée au Québec
483,Poissons,Chaboisseau arctique,,Arctic Sculpin,,Myoxocephalus scorpioides,,,Indigène,Régulier,Confirmé,Toute l'année,Actinopterygii,Perciformes,Psychrolutidae,Myoxocephalus,scorpioides,,S4,Non suivie,Pêches et Océans Canada
481,Poissons,Chaboisseau bronzé,crapaud de mer nain,Grubby,Little Sculpin,Myoxocephalus aenaeus,,,Indigène,Régulier,Confirmé,Toute l'année,Actinopterygii,Perciformes,Psychrolutidae,Myoxocephalus,aenaeus,,S4,Non suivie,Pêches et Océans Canada
478,Poissons,Chabot à tête plate,,Spoonhead Sculpin,Spoonhead muddler; Rice's sculpin,Cottus ricei,,,Indigène,Régulier,Confirmé,Toute l'année,Actinopterygii,Perciformes,Cottidae,Cottus,ricei,,S5,Non suivie,Déléguée au Québec
480,Poissons,Chabot de profondeur,"COSEPAC: chabot de profondeur, pop. des Grands Lacs et du haut Saint-Laurent",Deepwater Sculpin,Sculpin; Lake Sculoin; Deep-water Blob; Fourhorn SculpinNachtrieb Dace; Northern Minnow; Pearl Dace; Allegheny Pearl Dace;,Myoxocephalus thompsonii,Myoxocephalus quadricornis,,Indigène,Régulier,Confirmé,Toute l'année,Actinopterygii,Perciformes,Psychrolutidae,Myoxocephalus,thompsonii,,S1,Menacée,Déléguée au Québec
476,Poissons,Chabot tacheté,chabot du nord; chabot des Grands Lacs,Mottled Sculpin,Northern Muddler; Northern Sculpin; Miller's Thumb; Blob,Cottus bairdii,,,Indigène,Régulier,Confirmé,Toute l'année,Actinopterygii,Perciformes,Cottidae,Cottus,bairdii,,S4S5,Non suivie,Déléguée au Québec
477,Poissons,Chabot visqueux,,Slimy Sculpin,Slimy Muddler; Eastern Slimy Sculpin; Miller's Thumb; Cockatouch,Cottus cognatus,,,Indigène,Régulier,Confirmé,Toute l'année,Actinopterygii,Perciformes,Cottidae,Cottus,cognatus,,S5,Non suivie,Déléguée au Québec
593,Poissons,Chat-fou brun,chat-fou,Tadpole Madtom,Schilbeodes Mollis; Mad Tom; Tadpole Stonecat; Tadpole Cat,Noturus gyrinus,,,Indigène,Régulier,Confirmé,Toute l'année,Actinopterygii,Siluriformes,Ictaluridae,Noturus,gyrinus,,S4,Non suivie,Déléguée au Québec
592,Poissons,Chat-fou des rapides,barbotte des rapides,Stonecat,Stone Catfish; Stonecat Madtom; White Cat; Doogler,Noturus flavus,,"Le nom commun français diffère de celui utilisé dans la publication ""American Fisheries Society (2013) Common and Scientific Names of Fishes from the United States, Canada, and Mexico, 7th edition"", mais sera révisé lors de la prochaine publication.",Indigène,Régulier,Confirmé,Toute l'année,Actinopterygii,Siluriformes,Ictaluridae,Noturus,flavus,,S3,Vulnérable,Déléguée au Québec
594,Poissons,Chat-fou liséré,chat-fou livré,Margined Madtom,,Noturus insignis,,Espèce des côtes Atlantique Nord introduite par les canaux d'eau et dispersée ensuite comme appâts vivants.,Indigène,Régulier,Confirmé,Toute l'année,Actinopterygii,Siluriformes,Ictaluridae,Noturus,insignis,,S1?,Susceptible,Déléguée au Québec
30229,Poissons,Chauliode très lumineux,chauliode très-lumineux,Sloane's Viperfish,Manylight Viperfish,Chauliodus sloani,,,Indigène,Régulier,Confirmé,Non reproducteur,Actinopterygii,Stomiiformes,Stomiidae,Chauliodus,sloani,,S5,Non suivie,Pêches et Océans Canada
586,Poissons,Chevalier blanc,carpe blanche; suceur blanc; moxostome blanc,Silver Redhorse,Silver Mullet; White Nose Redhorse; White Nosed Mullet; White Nosed Sucker,Moxostoma anisurum,,,Indigène,Régulier,Confirmé,Toute l'année,Actinopterygii,Cypriniformes,Catostomidae,Moxostoma,anisurum,,S4,Non suivie,Déléguée au Québec
588,Poissons,Chevalier cuivré,suceur cuivré; moxostome cuivré; carpe cuivrée,Copper Redhorse,,Moxostoma hubbsi,,,Indigène,Régulier,Confirmé,Toute l'année,Actinopterygii,Cypriniformes,Catostomidae,Moxostoma,hubbsi,,S1,Menacée,Déléguée au Québec
587,Poissons,Chevalier de rivière,suceur ballot; moxostome ballot,River Redhorse,River Mullet,Moxostoma carinatum,,,Indigène,Régulier,Confirmé,Toute l'année,Actinopterygii,Cypriniformes,Catostomidae,Moxostoma,carinatum,,S2S3,Vulnérable,Déléguée au Québec
590,Poissons,Chevalier jaune,suceur jaune; moxostome jaune,Greater Redhorse,Common Redhorse; Redhorse,Moxostoma valenciennesi,,,Indigène,Régulier,Confirmé,Toute l'année,Actinopterygii,Cypriniformes,Catostomidae,Moxostoma,valenciennesi,,S3,Non suivie,Déléguée au Québec
589,Poissons,Chevalier rouge,suceur rouge; moxostome à cochon,Shorthead Redhorse,Northern Shorthead Redhorse; Short-headed Red-horse; Common Redhorse; Short-headed Mullet,Moxostoma macrolepidotum,,,Indigène,Régulier,Confirmé,Toute l'année,Actinopterygii,Cypriniformes,Catostomidae,Moxostoma,macrolepidotum,,S4,Non suivie,Déléguée au Québec
31166,Poissons,Chinchard frappeur,,Rough Scad,,Trachurus lathami,,,Indigène,Accidentel/Non régulier,Confirmé,Migrateur,Actinopterygii,Perciformes,Carangidae,Trachurus,lathami,,SNA,Non suivie,
618,Poissons,Choquemort,,Mummichog,,Fundulus heteroclitus,,,Indigène,Régulier,Confirmé,Toute l'année,Actinopterygii,Cyprinodontiformes,Fundulidae,Fundulus,heteroclitus,,S5,Non suivie,Déléguée au Québec
528,Poissons,Cisco de lac,toulibi;  hareng de lac,Cisco,Lake Cisco; Lake Herring; Shallowwater Cisco; Shallowwater Cisco,Coregonus artedi,Coregonus artedii; Leucichthys artedii,"Il s'agit d'une population confinée au lac des Écorces, près de Mont-Laurier et qui fraie au printemps plutôt qu'à l'automne. Selon les données actuelles, cette population frayant au printemps est unique au monde.",Indigène,Régulier,Confirmé,Toute l'année,Actinopterygii,Salmoniformes,Salmonidae,Coregonus,artedi,,S4,Non suivie,Déléguée au Québec
529,Poissons,Cisco de printemps,"cisco de lac, pop. de printemps; toulibi; hareng de lac",Spring Cisco,Shallowwater Cisco,Coregonus artedi pop. 1,Coregonus artedii; Leucichthys artedii,,Indigène,Régulier,Confirmé,Toute l'année,Actinopterygii,Salmoniformes,Salmonidae,Coregonus,artedi,pop. 1,S1,Menacée,Déléguée au Québec
490,Poissons,Cotte polaire,,Polar Sculpin,,Cottunculus microps,,,Indigène,Régulier,Confirmé,Inconnu/non déterminé,Actinopterygii,Perciformes,Psychrolutidae,Cottunculus,microps,,S4,Non suivie,Pêches et Océans Canada
583,Poissons,Couette,brême,Quillback,Lake Quillback; Carpsucker; Long-finned Sucker; Mullet,Carpiodes cyprinus,,,Indigène,Régulier,Confirmé,Toute l'année,Actinopterygii,Cypriniformes,Catostomidae,Carpiodes,cyprinus,,S3S4,Non suivie,Déléguée au Québec
633,Poissons,Crapet arlequin,crapet commun à oreilles bleues; crapet à oreilles bleues,Bluegill,Bluegill Bream; Roach; Northern Bluegill Sunfish; Blue Sunfish,Lepomis macrochirus,,,Indigène,Régulier,Confirmé,Toute l'année,Actinopterygii,Perciformes,Centrarchidae,Lepomis,macrochirus,,S4,Non suivie,Déléguée au Québec
631,Poissons,Crapet de roche,crapet de roche du Nord; crapet aux yeux rouges; achigan de roche,Rock Bass,Northern Rock Bass; Redeye; Redeye Bass; Goggle Eye,Ambloplites rupestris,,,Indigène,Régulier,Confirmé,Toute l'année,Actinopterygii,Perciformes,Centrarchidae,Ambloplites,rupestris,,S5,Non suivie,Déléguée au Québec
634,Poissons,Crapet du Nord,crapet à longues oreilles du Nord; crapet à longues oreilles des Grands Lacs,Northern Sunfish,Long Ear Sunfish; Northern Longear; Great Lakes Longear Sunfish,Lepomis peltastes,,,Indigène,Régulier,Confirmé,Toute l'année,Actinopterygii,Perciformes,Centrarchidae,Lepomis,peltastes,,S2S3,Susceptible,Déléguée au Québec
30107,Poissons,Crapet vert,,Green sunfish,,Lepomis cyanellus,,,Exotique,Régulier,Confirmé,Toute l'année,Actinopterygii,Perciformes,Centrarchidae,Lepomis,cyanellus,,SNA,Non suivie,Déléguée au Québec
632,Poissons,Crapet-soleil,crapet jaune; perche-soleil; montre d'or,Pumpkinseed,Pumpkinseed Sunfish; Yellow Sunfish; Common Sunfish; Sun Bass,Lepomis gibbosus,,,Indigène,Régulier,Confirmé,Toute l'année,Actinopterygii,Perciformes,Centrarchidae,Lepomis,gibbosus,,S5,Non suivie,Déléguée au Québec
619,Poissons,Crayon d'argent,poisson d'argent de ruisseau du Nord,Brook Silverside,,Labidesthes sicculus,,,Indigène,Régulier,Confirmé,Toute l'année,Actinopterygii,Atheriniformes,Atherinopsidae,Labidesthes,sicculus,,S4,Non suivie,Déléguée au Québec
