ELEMENT_ID,GRAND_GROUPE,Nom_francais,Autres_noms_francais,Nom_anglais,Autres_noms_anglais,Nom_scientifique,Anciens_noms_scientifiques,Commentaires,Origine,Regularite,Degre_de_certitude,Statuts_des_populations,CLASSE,ORDRE,FAMILLE,GENRE,ESPECE,SOUS_ESPECE_POP,Rang_S,STATUT_LEMV,COMPETENCE_PRINCIPALE
185,Oiseaux,Bécasseau d'Alaska,bécasseau du Nord-Ouest; bécasseau occidental; maringouin; alouette de mer,Western Sandpiper,Rufous-necked Sandpiper; Mud Snipe; Sand Snipe; Snippet,Calidris mauri,,,Indigène,Régulier,Confirmé,Migrateur,Aves,Charadriiformes,Scolopacidae,Calidris,mauri,,S3M,Non suivie,Environnement et Changement climatique Canada
187,Oiseaux,Bécasseau minuscule,bécasseau minute d'Amérique; ricuit; alouette de mer; maubèche minime,Least Sandpiper,American Stint; Marsh Peep; Meadow Oxeye; Wilson's Sandpiper,Calidris minutilla,,,Indigène,Régulier,Confirmé,Reproducteur,Aves,Charadriiformes,Scolopacidae,Calidris,minutilla,,S4B,Non suivie,Environnement et Changement climatique Canada
188,Oiseaux,Bécasseau à croupion blanc,bécasseau de Bonaparte; bécasseau Bonaparte; alouette de mer; ricuit,White-rumped Sandpiper,White Rumped Sandpiper; Shinz Sandpiper; Bonaparte's Sandpiper,Calidris fuscicollis,,,Indigène,Régulier,Confirmé,Migrateur,Aves,Charadriiformes,Scolopacidae,Calidris,fuscicollis,,S4M,Non suivie,Environnement et Changement climatique Canada
189,Oiseaux,Bécasseau de Baird,maubèche de Baird,Baird's Sandpiper,Mud Snipe; Sand Snipe; Snippet,Calidris bairdii,,,Indigène,Régulier,Confirmé,Migrateur,Aves,Charadriiformes,Scolopacidae,Calidris,bairdii,,S3M,Non suivie,Environnement et Changement climatique Canada
190,Oiseaux,Bécasseau à poitrine cendrée,bécasseau tacheté; bécasseau à poitrine tachetée; bécasseau des sables; bécassine à poitrine cendrée,Pectoral Sandpiper,,Calidris melanotos,,,Indigène,Régulier,Confirmé,Reproducteur,Aves,Charadriiformes,Scolopacidae,Calidris,melanotos,,S3S4M,Non suivie,Environnement et Changement climatique Canada
191,Oiseaux,Bécasseau à queue pointue,bécasseau à queue fine,Sharp-tailed Sandpiper,,Calidris acuminata,,,Indigène,Accidentel/non régulier,Confirmé,Migrateur,Aves,Charadriiformes,Scolopacidae,Calidris,acuminata,,SNA,Non suivie,Environnement et Changement climatique Canada
192,Oiseaux,Bécasseau violet,bécasseau maritima; maubèche maritime; maubèche des roches; maubèche pourprée,Purple Sandpiper,Rock Snipe; Rockweed Bird; Big beachy; Purple-back,Calidris maritima,,,Indigène,Régulier,Confirmé,Migrateur,Aves,Charadriiformes,Scolopacidae,Calidris,maritima,,S3M,Non suivie,Environnement et Changement climatique Canada
193,Oiseaux,Bécasseau variable,bécasseau à dos roux; alouette de mer; bécasseau cincle; bécasseau des Alpes,Dunlin,,Calidris alpina,,,Indigène,Régulier,Confirmé,Reproducteur,Aves,Charadriiformes,Scolopacidae,Calidris,alpina,,S3B,Non suivie,Environnement et Changement climatique Canada
194,Oiseaux,Bécasseau cocorli,cocorli; pélidne cocorli; maubèche courlis; courlis,Curlew Sandpiper,,Calidris ferruginea,,,Indigène,Accidentel/non régulier,Confirmé,Migrateur,Aves,Charadriiformes,Scolopacidae,Calidris,ferruginea,,SNA,Non suivie,Environnement et Changement climatique Canada
195,Oiseaux,Bécasseau à échasses,bécasseau échasse; chevalier échasse; chevalier pieds verts; bégas,Stilt Sandpiper,Long-legged Sandpiper; Mongrel; Bastar Yellowlegs; Greenleg,Calidris himantopus,Micropalama himantopus,,Indigène,Régulier,Confirmé,Migrateur,Aves,Charadriiformes,Scolopacidae,Calidris,himantopus,,S3M,Non suivie,Environnement et Changement climatique Canada
196,Oiseaux,Bécasseau roussâtre,bécasseau rousset; aetiture rousset; maubèche roussâtre; maubèche à poitrine jaunâtre,Buff-breasted Sandpiper,Cherook; Robin snipe,Calidris subruficollis,,,Indigène,Régulier,Confirmé,Migrateur,Aves,Charadriiformes,Scolopacidae,Calidris,subruficollis,,S3M,Candidate,Environnement et Changement climatique Canada
197,Oiseaux,Combattant varié,bécasseau combattant; chevalier combattant; bécasseau combattant; combattant,Ruff,Reeve,Calidris pugnax,,,Indigène,Régulier,Confirmé,Migrateur,Aves,Charadriiformes,Scolopacidae,Calidris,pugnax,,SNA,Non suivie,Environnement et Changement climatique Canada
198,Oiseaux,Bécassin roux,bécasseau roux; limnodrome à bec court; limnodrome gris; macroramphe gris,Short-billed Dowitcher,Common Dowitcher; Eastern Dowitcher; American Dowitcher; Brown Snipe,Limnodromus griseus,,,Indigène,Régulier,Confirmé,Reproducteur,Aves,Charadriiformes,Scolopacidae,Limnodromus,griseus,,S3S4B,Non suivie,Environnement et Changement climatique Canada
199,Oiseaux,Bécassin à long bec,limnodrome à long bec; bécasseau à long bec; macro-ramphe du Nord; macroramphe gris,Long-billed Dowitcher,,Limnodromus scolopaceus,,,Indigène,Régulier,Confirmé,Migrateur,Aves,Charadriiformes,Scolopacidae,Limnodromus,scolopaceus,,S3M,Non suivie,Environnement et Changement climatique Canada
200,Oiseaux,Bécassine de Wilson,bécassine des marais; bécassine ordinaire; chevelle; chevrette,Wilson's Snipe,Common Snipe; Wilson's Snipe; Alewife-bird; European Snipe,Gallinago delicata,Gallinago gallinago,,Indigène,Régulier,Confirmé,Reproducteur,Aves,Charadriiformes,Scolopacidae,Gallinago,delicata,,S4S5B,Non suivie,Environnement et Changement climatique Canada
202,Oiseaux,Bécasse d'Amérique,bécasse américaine; bécassine,American Woodcock,Blind Snipe; Bog Bird; English Snipe; Mudhen,Scolopax minor,,,Indigène,Régulier,Confirmé,Reproducteur,Aves,Charadriiformes,Scolopacidae,Scolopax,minor,,S5B,Non suivie,Environnement et Changement climatique Canada
203,Oiseaux,Phalarope de Wilson,phalarope; phalarope d'Amérique,Wilson's Phalarope,Mackerel-goose; Grunter,Phalaropus tricolor,Steganopus tricolor,,Indigène,Régulier,Confirmé,Reproducteur,Aves,Charadriiformes,Scolopacidae,Phalaropus,tricolor,,S2B,Non suivie,Environnement et Changement climatique Canada
204,Oiseaux,Phalarope à bec étroit,phalarope hyperboréen; phalarope hyperboré; phalarope à bec mince; phalarope,Red-necked Phalarope,Cock Coot-footed Tringa; Web-footed Peep; White Bankbird; Northern Phalarope,Phalaropus lobatus,,,Indigène,Régulier,Confirmé,Reproducteur,Aves,Charadriiformes,Scolopacidae,Phalaropus,lobatus,,S3S4B,Non suivie,Environnement et Changement climatique Canada
205,Oiseaux,Phalarope à bec large,phalarope roux; phalarope; phalarope à large bec; phalarope platyrhynque,Red Phalarope,Grey Phalarope; Red Coot-footed Tringa; Flat-billed Phalarope; Coot-footed Tringa,Phalaropus fulicarius,Phalaropus fulicaria,,Indigène,Régulier,Confirmé,Reproducteur,Aves,Charadriiformes,Scolopacidae,Phalaropus,fulicarius,,S4M,Non suivie,Environnement et Changement climatique Canada
206,Oiseaux,Labbe pomarin,stercoraire pomarin; diabloteau,Pomarine Jaeger,Aret; Black Marling Spike; Bosun Bird; Gull Chaser,Stercorarius pomarinus,,,Indigène,Régulier,Confirmé,Reproducteur,Aves,Charadriiformes,Stercorariidae,Stercorarius,pomarinus,,S3B,Non suivie,Environnement et Changement climatique Canada
207,Oiseaux,Labbe parasite,stercoraire de Richardson; petit labbe parasite; stercoraire parasite; stercoraire arctique,Parasitic Jaeger,Arctic Skua; Richardson's Skua; Boatswain; Dung Hunter,Stercorarius parasiticus,,,Indigène,Régulier,Confirmé,Reproducteur,Aves,Charadriiformes,Stercorariidae,Stercorarius,parasiticus,,S3B,Non suivie,Environnement et Changement climatique Canada
208,Oiseaux,Labbe à longue queue,labbe longicaude; stercoraire longicaude; stercoraire à large queue; stercoraire de Buffon,Long-tailed Jaeger,Long-tailed Skua; Boats Wain; Buffon's Jaeger; Marline-spike,Stercorarius longicaudus,,,Indigène,Régulier,Confirmé,Reproducteur,Aves,Charadriiformes,Stercorariidae,Stercorarius,longicaudus,,S3B,Non suivie,Environnement et Changement climatique Canada
211,Oiseaux,Mouette atricille,mouette à tête noire; goéland atricille; mangui; mauve à tête noire,Laughing Gull,Sea Gull; Laughing Bird; Gullie; Black-head,Leucophaeus atricilla,Larus atricilla,,Indigène,Régulier,Confirmé,Migrateur,Aves,Charadriiformes,Laridae,Leucophaeus,atricilla,,SNA,Non suivie,Environnement et Changement climatique Canada
212,Oiseaux,Mouette de Franklin,mouette des Prairies; mouette ichtyaète; goéland de Franklin; mauve de Franklin,Franklin's Gull,Franklin's Rosy; Prairie Dove; Rosy Gull; Black-headed Gull,Leucophaeus pipixcan,Larus pipixcan,,Indigène,Régulier,Confirmé,Migrateur,Aves,Charadriiformes,Laridae,Leucophaeus,pipixcan,,SNA,Non suivie,Environnement et Changement climatique Canada
213,Oiseaux,Mouette pygmée,petite mouette; goéland à pieds rouges; goéland pygmée,Little Gull,,Hydrocoloeus minutus,Larus minutus,,Indigène,Régulier,Confirmé,Reproducteur,Aves,Charadriiformes,Laridae,Hydrocoloeus,minutus,,S3M,Non suivie,Environnement et Changement climatique Canada
214,Oiseaux,Mouette rieuse,mouette rieuse d'Europe; rieuse; goéland rieur; mouette à capuchon brun,Black-headed Gull,Black-headed Gull; Brown-headed Gull,Chroicocephalus ridibundus,Larus ridibundus,,Indigène,Régulier,Confirmé,Reproducteur,Aves,Charadriiformes,Laridae,Chroicocephalus,ridibundus,,S3B,Non suivie,Environnement et Changement climatique Canada
215,Oiseaux,Mouette de Bonaparte,mouette Bonaparte; goéland Bonaparte; mauve de Bonaparte; mauve,Bonaparte's Gull,Rosy Gull; Blackhead; Mackerel Gull; Sea Pigeon,Chroicocephalus philadelphia,Larus philadelphia,,Indigène,Régulier,Confirmé,Reproducteur,Aves,Charadriiformes,Laridae,Chroicocephalus,philadelphia,,S4B,Non suivie,Environnement et Changement climatique Canada
216,Oiseaux,Goéland cendré,goéland à bec court; goéland brun; goéland à petit bec; goéland à pieds bleus,Mew Gull,Short-billed Gull; Common Gull,Larus canus,,,Indigène,Accidentel/non régulier,Confirmé,Migrateur,Aves,Charadriiformes,Laridae,Larus,canus,,SNA,Non suivie,Environnement et Changement climatique Canada
217,Oiseaux,Goéland à bec cerclé,mouette de Delaware; goéland à bec anneau noir; goéland américain commun; goéland criard,Ring-billed Gull,Pond Gull; Sea Gull; Squeaky Gull; Squeezy Gull,Larus delawarensis,,,Indigène,Régulier,Confirmé,Reproducteur,Aves,Charadriiformes,Laridae,Larus,delawarensis,,S5B,Non suivie,Environnement et Changement climatique Canada
218,Oiseaux,Goéland de Californie,,California Gull,Blue Gull; Sea Gull; Morman gull,Larus californicus,,,Indigène,Accidentel/non régulier,Confirmé,Migrateur,Aves,Charadriiformes,Laridae,Larus,californicus,,SNA,Non suivie,Environnement et Changement climatique Canada
219,Oiseaux,Goéland hudsonien,goéland argenté; goéland à manteau bleu; grisard; goéland; goillan,American Herring Gull,Herring Gull; Harbour Gull; Common Sea Gull;,Larus smithsonianus,Larus argentatus,,Indigène,Régulier,Confirmé,Reproducteur,Aves,Charadriiformes,Laridae,Larus,smithsonianus,,S4B,Non suivie,Environnement et Changement climatique Canada
221,Oiseaux,Goéland arctique,,Iceland Gull,,Larus glaucoides,Larus thayeri,,Indigène,Régulier,Confirmé,Toute l'année,Aves,Charadriiformes,Laridae,Larus,glaucoides,,S3S4,Non suivie,Environnement et Changement climatique Canada
223,Oiseaux,Goéland brun,goéland à manteau brun; goéland à pieds jaunes; petit goéland à manteau noir; petit manteau noir,Lesser Black-backed Gull,Scandinavian Lesser Black-backed Gull,Larus fuscus,,,Indigène,Régulier,Confirmé,Migrateur,Aves,Charadriiformes,Laridae,Larus,fuscus,,S4M,Non suivie,Environnement et Changement climatique Canada
224,Oiseaux,Goéland à manteau ardoisé,,Slaty-backed Gull,,Larus schistisagus,Brachyramphus schistisagus,,Indigène,Accidentel/non régulier,Confirmé,Migrateur,Aves,Charadriiformes,Laridae,Larus,schistisagus,,SNA,Non suivie,Environnement et Changement climatique Canada
226,Oiseaux,Goéland bourgmestre,goéland à manteau gris; bourgmestre; goéland à dos bleuâtre; goéland à manteau glauque,Glaucous Gull,Owly Gull; Point Barrow Gull; Hutchin's Gull; Burgomaster,Larus hyperboreus,,,Indigène,Régulier,Confirmé,Toute l'année,Aves,Charadriiformes,Laridae,Larus,hyperboreus,,S4,Non suivie,Environnement et Changement climatique Canada
227,Oiseaux,Goéland marin,goéland à manteau noir; grand manteau noir; goéland maritime; grand goéland à manteau noir,Great Black-backed Gull,Common Black-headed; Black-backed Gull; Black-back; Cobb,Larus marinus,,,Indigène,Régulier,Confirmé,Reproducteur,Aves,Charadriiformes,Laridae,Larus,marinus,,S4B,Non suivie,Environnement et Changement climatique Canada
228,Oiseaux,Goéland leucophée,,Yellow-legged Gull,,Larus michahellis,Larus cachinnans,,Indigène,Accidentel/non régulier,Confirmé,Migrateur,Aves,Charadriiformes,Laridae,Larus,michahellis,,SNA,Non suivie,Environnement et Changement climatique Canada
229,Oiseaux,Mouette tridactyle,mauve; goéland Tridactyle; mouette; mauve à trois doigts,Black-legged Kittiwake,Cahavac; Risse Tridactyle; Atlantic Kittiwake; Coddy,Rissa tridactyla,,,Indigène,Régulier,Confirmé,Reproducteur,Aves,Charadriiformes,Laridae,Rissa,tridactyla,,S4B,Non suivie,Environnement et Changement climatique Canada
230,Oiseaux,Mouette rosée,,Ross's Gull,,Rhodostethia rosea,,,Indigène,Accidentel/non régulier,Confirmé,Migrateur,Aves,Charadriiformes,Laridae,Rhodostethia,rosea,,SNA,Non suivie,Environnement et Changement climatique Canada
231,Oiseaux,Mouette de Sabine,goéland de Sabine; mauve de Sabine,Sabine's Gull,Sabine Gull; Fork-tailed Gull,Xema sabini,,,Indigène,Régulier,Confirmé,Migrateur,Aves,Charadriiformes,Laridae,Xema,sabini,,S3M,Non suivie,Environnement et Changement climatique Canada
232,Oiseaux,Mouette blanche,goéland sénateur; mouette ivoire; goéland blanc; mouette sénateur,Ivory Gull,White-winged Gull; Duck Gull; Ice Bird; Ice Gull,Pagophila eburnea,,,Indigène,Accidentel/non régulier,Confirmé,Migrateur,Aves,Charadriiformes,Laridae,Pagophila,eburnea,,SNA,Non suivie,Environnement et Changement climatique Canada
233,Oiseaux,Sterne caspienne,sterne tchégrava; sterne tschegrava; hydroprogné tschégrava; grand esterette,Caspian Tern,Gannet Striker; Great Tern; Imperial Tern; Redbill,Hydroprogne caspia,Sterna caspia,,Indigène,Régulier,Confirmé,Reproducteur,Aves,Charadriiformes,Laridae,Hydroprogne,caspia,,S1B,Menacée,Environnement et Changement climatique Canada
234,Oiseaux,Sterne caugek,,Sandwich Tern,,Thalasseus sandvicensis,Sterna sandvicensis,,Indigène,Accidentel/non régulier,Confirmé,Migrateur,Aves,Charadriiformes,Laridae,Thalasseus,sandvicensis,,SNA,Non suivie,Environnement et Changement climatique Canada
235,Oiseaux,Sterne de Dougall,sterne rosée; sterne rose,Roseate Tern,McDougall's tern,Sterna dougallii,,,Indigène,Régulier,Confirmé,Reproducteur,Aves,Charadriiformes,Laridae,Sterna,dougallii,,S1B,Menacée,Environnement et Changement climatique Canada
236,Oiseaux,Sterne pierregarin,sterne commune; hirondelle de mer pierre-garin; esterlet; petite mauve,Common Tern,Havells tern; Red-shank; Summer Gull; Tlarr,Sterna hirundo,,,Indigène,Régulier,Confirmé,Reproducteur,Aves,Charadriiformes,Laridae,Sterna,hirundo,,S4B,Non suivie,Environnement et Changement climatique Canada
237,Oiseaux,Sterne arctique,sterne paradis; hirondelle de mer; sterlet; sterne à longue queue,Arctic Tern,Blackhead; Greenland Swallow; Crimson-billed Tern; Long-tailed Tern,Sterna paradisaea,,,Indigène,Régulier,Confirmé,Reproducteur,Aves,Charadriiformes,Laridae,Sterna,paradisaea,,S4B,Non suivie,Environnement et Changement climatique Canada
238,Oiseaux,Sterne de Forster,esterelle,Forster's Tern,Tern,Sterna forsteri,,,Indigène,Accidentel/non régulier,Confirmé,Migrateur,Aves,Charadriiformes,Laridae,Sterna,forsteri,,SNA,Non suivie,Environnement et Changement climatique Canada
240,Oiseaux,Sterne fuligineuse,,Sooty Tern,,Onychoprion fuscatus,Sterna fuscata,,Indigène,Accidentel/non régulier,Confirmé,Migrateur,Aves,Charadriiformes,Laridae,Onychoprion,fuscatus,,SNA,Non suivie,Environnement et Changement climatique Canada
241,Oiseaux,Guifette leucoptère,guifette à ailes blanches; sterne leucoptère; sterne noire à ailes blanches,White-winged Tern,White-winged Black Tern,Chlidonias leucopterus,,,Indigène,Accidentel/non régulier,Confirmé,Migrateur,Aves,Charadriiformes,Laridae,Chlidonias,leucopterus,,SNA,Non suivie,Environnement et Changement climatique Canada
242,Oiseaux,Guifette noire,sterne noire; mouette noire; épouvantail; sterne épouvantail,Black Tern,Black-billied tern; Short-tailed Tern; Sea Pigeon; Semipalmated Tern,Chlidonias niger,,,Indigène,Régulier,Confirmé,Reproducteur,Aves,Charadriiformes,Laridae,Chlidonias,niger,,S2S3B,Candidate,Environnement et Changement climatique Canada
243,Oiseaux,Bec-en-ciseaux noir,bec-en-ciseaux; bec-en-ciseaux d'Amérique; bec-en-ciseaux américain,Black Skimmer,Cut Water; Flood Gull; Razor-bill; Scissor Bill,Rynchops niger,,,Indigène,Accidentel/non régulier,Confirmé,Migrateur,Aves,Charadriiformes,Laridae,Rynchops,niger,,SNA,Non suivie,Environnement et Changement climatique Canada
244,Oiseaux,Mergule nain,mergule; pigeon; petit guillemot; oiseau de misère,Dovekie,Bull; Bull Bird; Gilly; Little Auk,Alle alle,,,Indigène,Régulier,Confirmé,Migrateur,Aves,Charadriiformes,Alcidae,Alle,alle,,S4M,Non suivie,Environnement et Changement climatique Canada
245,Oiseaux,Guillemot marmette,marmette de Troïl; marmette de l'Atlantique; marmette de Calofornie; guillemot bridé,Common Murre,Thin-billed Murre; Atlantic Murre; California Murre; Common Guillemot,Uria aalge,,,Indigène,Régulier,Confirmé,Reproducteur,Aves,Charadriiformes,Alcidae,Uria,aalge,,S5B,Non suivie,Environnement et Changement climatique Canada
246,Oiseaux,Guillemot de Brünnich,marmette de Brünnich; guillemot à gros bec; marmette; guillemot arra,Thick-billed Murre,Brunnich's Guillemot; Brünnich's Murre; Frank's guillemot; Thick-billed Guillemot,Uria lomvia,,,Indigène,Régulier,Confirmé,Reproducteur,Aves,Charadriiformes,Alcidae,Uria,lomvia,,S4B,Non suivie,Environnement et Changement climatique Canada
247,Oiseaux,Petit pingouin,gode; pingouin torda; pingouin macroptère; pingouin,Razorbill,Auk; Baccaloo; Backalew Bird; Hawk-billed Murre,Alca torda,,,Indigène,Régulier,Confirmé,Reproducteur,Aves,Charadriiformes,Alcidae,Alca,torda,,S5B,Non suivie,Environnement et Changement climatique Canada
249,Oiseaux,Guillemot à miroir,guillemot noir; guillemot à mirroir blanc; guillemot grylle; guillemot,Black Guillemot,Mandt's Guillemot; Pigeon Murre; White-winged Guillemot,Cepphus grylle,,,Indigène,Régulier,Confirmé,Reproducteur,Aves,Charadriiformes,Alcidae,Cepphus,grylle,,S4S5B,Non suivie,Environnement et Changement climatique Canada
250,Oiseaux,Guillemot à long bec,guillemot marbré; alque marbrée; murrelet marmoré; murrelet marbré,Long-billed Murrelet,Marbled Murrelet; Marbled Guillemot; Dabchick; Sea Chick,Brachyramphus perdix,Brachyramphus marmoratus,,Indigène,Accidentel/non régulier,Confirmé,Migrateur,Aves,Charadriiformes,Alcidae,Brachyramphus,perdix,,SNA,Non suivie,Environnement et Changement climatique Canada
251,Oiseaux,Guillemot à cou blanc,alque à cou blanc; alque starique; guillemot antique; alque antique,Ancient Murrelet,,Synthliboramphus antiquus,,,Indigène,Accidentel/non régulier,Confirmé,Migrateur,Aves,Charadriiformes,Alcidae,Synthliboramphus,antiquus,,SNA,Non suivie,Environnement et Changement climatique Canada
252,Oiseaux,Macareux moine,macareux artique; puffin; macareux de l'Atlantique; macareux commun,Atlantic Puffin,Sea Parrot; Large-billed Puffin; Paroquet,Fratercula arctica,,,Indigène,Régulier,Confirmé,Reproducteur,Aves,Charadriiformes,Alcidae,Fratercula,arctica,,S3B,Non suivie,Environnement et Changement climatique Canada
253,Oiseaux,Pigeon biset,pigeon domestique; pigeon de roche; pigeon sauvage; pigeon biset sauvage,Rock Pigeon,Xixell; Feral Pigeon; Feral Rock Dove; Domestic Pigeon,Columba livia,,,Exotique,Régulier,Confirmé,Toute l'année,Aves,Columbiformes,Columbidae,Columba,livia,,SNA,Non suivie,Québec
254,Oiseaux,Tourterelle à ailes blanches,colombe à ailes blanches,White-winged Dove,Brown Indian Dove; Whitewing,Zenaida asiatica,,,Indigène,Accidentel/non régulier,Confirmé,Migrateur,Aves,Columbiformes,Columbidae,Zenaida,asiatica,,SNA,Non suivie,Environnement et Changement climatique Canada
255,Oiseaux,Tourterelle triste,colombe de la Caroline; tourterelle pleureuse; pigeon pleurard; tourterelle queue-fine,Mourning Dove,American Mourning Dove; Domestic Pigeon; Wood Pigeon; Long-tailed Dove,Zenaida macroura,,,Indigène,Régulier,Confirmé,Toute l'année,Aves,Columbiformes,Columbidae,Zenaida,macroura,,S4S5B,Non suivie,Environnement et Changement climatique Canada
257,Oiseaux,Coulicou à bec noir,coucou aux yeux rouges; piaya aux yeux rouges; piaye aux yeux rouges; coulicou aux yeux rouges,Black-billed Cuckoo,Cuckoo; Rain Bird; Rain Crow,Coccyzus erythropthalmus,,,Indigène,Régulier,Confirmé,Reproducteur,Aves,Cuculiformes,Cuculidae,Coccyzus,erythropthalmus,,S4B,Non suivie,Environnement et Changement climatique Canada
258,Oiseaux,Coulicou à bec jaune,coulicou américain; coulicou; coucou des pluies; coucou américain à bec jaune,Yellow-billed Cuckoo,May Bird; Four-o'clock Bird; Mani-coco; Coffin Bird,Coccyzus americanus,,,Indigène,Régulier,Confirmé,Reproducteur,Aves,Cuculiformes,Cuculidae,Coccyzus,americanus,,S2S3B,Non suivie,Environnement et Changement climatique Canada
261,Oiseaux,Petit-duc maculé,petit duc; scops d'Amérique; petit hibou; moyen duc,Eastern Screech-owl,Common Screech Owl; Screech Owl; Barn Owl; Hoot Owl,Megascops asio,Otus asio,,Indigène,Régulier,Confirmé,Toute l'année,Aves,Strigiformes,Strigidae,Megascops,asio,,S3S4,Non suivie,Québec
262,Oiseaux,Grand-duc d'Amérique,grand-duc de Virginie; hibou de Virginie; hibou à aigrettes; hibou des pins,Great Horned Owl,Virginia Eared Owl; Labrador Horned Owl; Horned Owl; Big Owl,Bubo virginianus,,,Indigène,Régulier,Confirmé,Toute l'année,Aves,Strigiformes,Strigidae,Bubo,virginianus,,S5,Non suivie,Québec
263,Oiseaux,Harfang des neiges,chouette harfang; harfang; surnie harfang; chouette blanche,Snowy Owl,Arctic Owl; Northern Owl; Snow Owl; White Owl,Bubo scandiacus,Nyctea scandiaca,,Indigène,Régulier,Confirmé,Toute l'année,Aves,Strigiformes,Strigidae,Bubo,scandiacus,,S4,Non suivie,Québec
264,Oiseaux,Chouette épervière,surnie épervière; surnie; surnie caparoch américaine; surnie caparoch européenne,Northern Hawk Owl,Northern Hawk-owl; Hawk-owl; Toot-owl; Hawk Owl,Surnia ulula,,,Indigène,Régulier,Confirmé,Toute l'année,Aves,Strigiformes,Strigidae,Surnia,ulula,,S4,Non suivie,Québec
265,Oiseaux,Chevêche des terriers,chouette des terriers; hibou de terrier; hibou des lapins d'Amérique; chevêche fouisseuse,Burrowing Owl,,Athene cunicularia,Speotyto cunicularia,,Indigène,Accidentel/non régulier,Confirmé,Migrateur,Aves,Strigiformes,Strigidae,Athene,cunicularia,,SNA,Non suivie,Québec
266,Oiseaux,Chouette rayée,chevèche; chouette du Canada,Barred Owl,Grey Owl; Hoot Owl; Mouse Owl; Round-headed Owl,Strix varia,,,Indigène,Régulier,Confirmé,Toute l'année,Aves,Strigiformes,Strigidae,Strix,varia,,S5,Non suivie,Québec
267,Oiseaux,Chouette lapone,chouette cendrée; duc de Laponie; chouette de Laponie; hibou cendré,Great Gray Owl,Cinereous Owl; Grey Owl; Peckled Owl,Strix nebulosa,,,Indigène,Régulier,Confirmé,Toute l'année,Aves,Strigiformes,Strigidae,Strix,nebulosa,,S4,Retirée,Québec
268,Oiseaux,Hibou moyen-duc,hibou à aigrettes longues; petit duc; moyen-duc; hibou commun,Long-eared Owl,Common Long-eared Owl; American long-eared Owl,Asio otus,,,Indigène,Régulier,Confirmé,Reproducteur,Aves,Strigiformes,Strigidae,Asio,otus,,S4B,Non suivie,Québec
269,Oiseaux,Hibou des marais,hibou de brachyote; chat-huant; effraie; fressaie,Short-eared Owl,American Short-eared Owl,Asio flammeus,,,Indigène,Régulier,Confirmé,Reproducteur,Aves,Strigiformes,Strigidae,Asio,flammeus,,S3B,Susceptible,Québec
270,Oiseaux,Nyctale de Tengmalm,nyctale boréale; chouette de Tengmalm; aegolie Tengmalm; chouette pattue,Boreal Owl,Tengmalm; Tengmalm's Owl; Arctic Saw-whet Owl,Aegolius funereus,,,Indigène,Régulier,Confirmé,Toute l'année,Aves,Strigiformes,Strigidae,Aegolius,funereus,,S4,Non suivie,Québec
271,Oiseaux,Petite nyctale,nyctale d'Acadie; chouette limard; chouette d'Acadie; chouette-scie,Northern Saw-whet Owl,Saw-whet Owl; Acadian Owl; Common Saw-whet Owl,Aegolius acadicus,,,Indigène,Régulier,Confirmé,Reproducteur,Aves,Strigiformes,Strigidae,Aegolius,acadicus,,S4S5B,Non suivie,Québec
272,Oiseaux,Engoulevent d'Amérique,engoulevent commun; engoulevent commun d'Amérique; engoulevent américain; engoulevent mange-maringouins,Common Nighthawk,Night-hawk,Chordeiles minor,,,Indigène,Régulier,Confirmé,Reproducteur,Aves,Caprimulgiformes,Caprimulgidae,Chordeiles,minor,,S3S4B,Susceptible,Environnement et Changement climatique Canada
273,Oiseaux,Engoulevent de Caroline,engoulevent à queue rousse; engoulevent de la Caroline,Chuck-will's-widow,Goat Sucker of Carolina,Antrostomus carolinensis,,,Indigène,Accidentel/non régulier,Confirmé,Migrateur,Aves,Caprimulgiformes,Caprimulgidae,Antrostomus,carolinensis,,SNA,Non suivie,Environnement et Changement climatique Canada
274,Oiseaux,Engoulevent bois-pourri,engoulevent criard; bois-pourri; engoulevent bruyant; engoulevent vocifère,Eastern Whip-poor-will,Whip-poor-will; Moskoto Hawk; Whip-her-well,Antrostomus vociferus,Caprimulgus vociferus,,Indigène,Régulier,Confirmé,Reproducteur,Aves,Caprimulgiformes,Caprimulgidae,Antrostomus,vociferus,,S3B,Vulnérable,Environnement et Changement climatique Canada
