ELEMENT_ID,GRAND_GROUPE,Nom_francais,Autres_noms_francais,Nom_anglais,Autres_noms_anglais,Nom_scientifique,Anciens_noms_scientifiques,Commentaires,Origine,Regularite,Degre_de_certitude,Statuts_des_populations,CLASSE,ORDRE,FAMILLE,GENRE,ESPECE,SOUS_ESPECE_POP,Rang_S,STATUT_LEMV,COMPETENCE_PRINCIPALE
761,Mammifères,Souris sauteuse des champs,zapode des champs; souris sauteuse des prairies,Meadow Jumping Mouse,,Zapus hudsonius,,,Indigène,Régulier,Confirmé,Toute l'année,Mammalia,Rodentia,Dipodidae,Zapus,hudsonius,,S5,Non suivie,Québec
762,Mammifères,Souris sauteuse des bois,zapode des bois,Woodland Jumping Mouse,,Napaeozapus insignis,,,Indigène,Régulier,Confirmé,Toute l'année,Mammalia,Rodentia,Dipodidae,Napaeozapus,insignis,,S5,Non suivie,Québec
763,Mammifères,Porc-épic d'Amérique,,North American Porcupine,,Erethizon dorsatum,,,Indigène,Régulier,Confirmé,Toute l'année,Mammalia,Rodentia,Erethizontidae,Erethizon,dorsatum,,S5,Non suivie,Québec
765,Mammifères,Baleine à bec commune,hypéroodon boréal,Northern Bottlenose Whale,North Atlantic Bottle-nosed Whale,Hyperoodon ampullatus,,,Indigène,Accidentel/non régulier,Confirmé,Migrateur,Mammalia,Cetacea,Ziphiidae,Hyperoodon,ampullatus,,SNA,Non suivie,Pêches et Océans Canada
766,Mammifères,Cachalot macrocéphale,cachalot,Sperm Whale,,Physeter macrocephalus,,,Indigène,Régulier,Confirmé,Migrateur,Mammalia,Cetacea,Physeteridae,Physeter,macrocephalus,,SNA,Non suivie,Pêches et Océans Canada
768,Mammifères,"Béluga, pop. de l'Est de la baie d'Hudson",marsouin blanc; bélouga,Beluga Whale - Eastern Hudson Bay population,,Delphinapterus leucas pop. 1,,,Indigène,Régulier,Confirmé,Toute l'année,Mammalia,Cetacea,Monodontidae,Delphinapterus,leucas,pop. 1,S2,Susceptible,Pêches et Océans Canada
769,Mammifères,"Béluga, pop. de la baie d'Ungava",marsouin blanc; bélouga,Beluga Whale - Ungava Bay population,,Delphinapterus leucas pop. 2,,,Indigène,Régulier,Confirmé,Toute l'année,Mammalia,Cetacea,Monodontidae,Delphinapterus,leucas,pop. 2,S1,Susceptible,Pêches et Océans Canada
770,Mammifères,"Béluga, pop. de l'estuaire du Saint-Laurent",marsouin blanc; bélouga,Beluga Whale - St. Lawrence Estuary population,,Delphinapterus leucas pop. 3,,,Indigène,Régulier,Confirmé,Toute l'année,Mammalia,Cetacea,Monodontidae,Delphinapterus,leucas,pop. 3,S1,Menacée,Pêches et Océans Canada
771,Mammifères,Narval,,Narwhal,,Monodon monoceros,,,Indigène,Régulier,Confirmé,Migrateur,Mammalia,Cetacea,Monodontidae,Monodon,monoceros,,SNA,Non suivie,Pêches et Océans Canada
772,Mammifères,Dauphin bleu,,Striped Dolphin,,Stenella coeruleoalba,,,Indigène,Accidentel/non régulier,Confirmé,Migrateur,Mammalia,Cetacea,Delphinidae,Stenella,coeruleoalba,,SNA,Non suivie,Pêches et Océans Canada
773,Mammifères,Dauphin à nez blanc,dauphin à bec blanc; lagénorhynque à bec blanc; sauteur; cochon de mer,White-beaked Dolphin,,Lagenorhynchus albirostris,,,Indigène,Régulier,Confirmé,Toute l'année,Mammalia,Cetacea,Delphinidae,Lagenorhynchus,albirostris,,S3,Non suivie,Pêches et Océans Canada
774,Mammifères,Dauphin à flancs blancs de l'Atlantique,lagénorhynque à flancs blancs; lagénorhynque de l'Atlantique; sauteur; cochon de mer,Atlantic White-sided Dolphin,,Lagenorhynchus acutus,Leucopleurus acutus,,Indigène,Régulier,Confirmé,Toute l'année,Mammalia,Cetacea,Delphinidae,Lagenorhynchus,acutus,,S4,Non suivie,Pêches et Océans Canada
775,Mammifères,Épaulard,orque; oequa,Killer Whale,,Orcinus orca,,,Indigène,Régulier,Confirmé,Toute l'année,Mammalia,Cetacea,Delphinidae,Orcinus,orca,,S3,Non suivie,Pêches et Océans Canada
776,Mammifères,Globicéphale noir,globicéphale noir de l'Atlantique,Long-finned Pilot Whale,Atlantic Pilot Whale; Blackfish; Pothead; Long-finned Pilot Whale,Globicephala melas,,,Indigène,Régulier,Confirmé,Toute l'année,Mammalia,Cetacea,Delphinidae,Globicephala,melas,,S4,Non suivie,Pêches et Océans Canada
777,Mammifères,Marsouin commun,pourcil,Harbor Porpoise,Pourcil; Common Porpoise,Phocoena phocoena,,,Indigène,Régulier,Confirmé,Toute l'année,Mammalia,Cetacea,Phocoenidae,Phocoena,phocoena,,S4,Susceptible,Pêches et Océans Canada
778,Mammifères,Rorqual commun,"rorqual commun, pop. de l'Atlantique",Fin Whale,,Balaenoptera physalus,,,Indigène,Régulier,Confirmé,Toute l'année,Mammalia,Cetacea,Balaenopteridae,Balaenoptera,physalus,,S3,Vulnérable,Pêches et Océans Canada
779,Mammifères,Rorqual boréal,baleinoptère de Rudolphi; baleinoptère boréal; rorqual du Nord; rorqual sei,Sei Whale,,Balaenoptera borealis,,,Indigène,Accidentel/non régulier,Confirmé,Migrateur,Mammalia,Cetacea,Balaenopteridae,Balaenoptera,borealis,,SNA,Non suivie,Pêches et Océans Canada
780,Mammifères,Petit rorqual,gibard; rorqual nain; rorqual à museau pointu,Common Minke Whale,,Balaenoptera acutorostrata,,,Indigène,Régulier,Confirmé,Toute l'année,Mammalia,Cetacea,Balaenopteridae,Balaenoptera,acutorostrata,,S4,Non suivie,Pêches et Océans Canada
781,Mammifères,Rorqual bleu,"rorqual bleu, pop. de l'Atlantique; grand rorqual; rorqual de Sibbald; baleine bleue",Blue Whale,,Balaenoptera musculus,,,Indigène,Régulier,Confirmé,Toute l'année,Mammalia,Cetacea,Balaenopteridae,Balaenoptera,musculus,,S1,Susceptible,Pêches et Océans Canada
782,Mammifères,Rorqual à bosse,baleine à bosse; megaptère; jubarte,Humpback Whale,,Megaptera novaeangliae,,,Indigène,Régulier,Confirmé,Toute l'année,Mammalia,Cetacea,Balaenopteridae,Megaptera,novaeangliae,,S3,Retirée,Pêches et Océans Canada
784,Mammifères,Baleine noire,baleine noire de l'Atlantique Nord; baleine franche noire; baleine franche boréale; baleine de Biscayne,Black Right Whale,North Atlantic Right Whale; Biscayan Right Whale,Eubalaena glacialis,,,Indigène,Régulier,Confirmé,Toute l'année,Mammalia,Cetacea,Balaenidae,Eubalaena,glacialis,,S1,Susceptible,Pêches et Océans Canada
785,Mammifères,Coyote,,Coyote,,Canis latrans,,,Indigène,Régulier,Confirmé,Toute l'année,Mammalia,Carnivora,Canidae,Canis,latrans,,S5,Non suivie,Québec
786,Mammifères,Loup,loup gris du Nord; loup gris; loup des bois,Gray Wolf,Timberwolf,Canis lupus,,,Indigène,Régulier,Confirmé,Toute l'année,Mammalia,Carnivora,Canidae,Canis,lupus,,S5,Non suivie,Québec
787,Mammifères,Renard arctique,,Arctic Fox,,Vulpes lagopus,Alopex lagopus,,Indigène,Régulier,Confirmé,Toute l'année,Mammalia,Carnivora,Canidae,Vulpes,lagopus,,S4,Non suivie,Québec
788,Mammifères,Renard roux,,Red Fox,,Vulpes vulpes,,,Indigène,Régulier,Confirmé,Toute l'année,Mammalia,Carnivora,Canidae,Vulpes,vulpes,,S5,Non suivie,Québec
789,Mammifères,Renard gris,,Gray Fox,,Urocyon cinereoargenteus,,,Indigène,Accidentel/non régulier,Confirmé,Non reproducteur,Mammalia,Carnivora,Canidae,Urocyon,cinereoargenteus,,SU,Non suivie,Québec
790,Mammifères,Ours noir,ours baribal,American Black Bear,,Ursus americanus,,,Indigène,Régulier,Confirmé,Toute l'année,Mammalia,Carnivora,Ursidae,Ursus,americanus,,S5,Non suivie,Québec
792,Mammifères,Ours blanc,ours polaire,Polar Bear,,Ursus maritimus,,,Indigène,Régulier,Confirmé,Non reproducteur,Mammalia,Carnivora,Ursidae,Ursus,maritimus,,S3,Vulnérable,Québec
794,Mammifères,Raton laveur,chat sauvage,Raccoon,,Procyon lotor,,,Indigène,Régulier,Confirmé,Toute l'année,Mammalia,Carnivora,Procyonidae,Procyon,lotor,,S5,Non suivie,Québec
795,Mammifères,Martre d'Amérique,,American Marten,Marten; Pine Marten,Martes americana,,,Indigène,Régulier,Confirmé,Toute l'année,Mammalia,Carnivora,Mustelidae,Martes,americana,,S5,Non suivie,Québec
796,Mammifères,Pékan,martre de pennant,Fisher,,Pekania pennanti,,,Indigène,Régulier,Confirmé,Toute l'année,Mammalia,Carnivora,Mustelidae,Pekania,pennanti,,S5,Non suivie,Québec
797,Mammifères,Hermine,,Ermine,Stoat; Short-tailed Weasel,Mustela richardsonii,Mustela erminea,,Indigène,Régulier,Confirmé,Toute l'année,Mammalia,Carnivora,Mustelidae,Mustela,richardsonii,,S5,Non suivie,Québec
798,Mammifères,Belette pygmée,petite belette,Least Weasel,,Mustela nivalis,,,Indigène,Régulier,Confirmé,Toute l'année,Mammalia,Carnivora,Mustelidae,Mustela,nivalis,,S2S3,Susceptible,Québec
799,Mammifères,Belette à longue queue,,Long-tailed Weasel,,Mustela frenata,,,Indigène,Régulier,Confirmé,Toute l'année,Mammalia,Carnivora,Mustelidae,Mustela,frenata,,S5,Non suivie,Québec
800,Mammifères,Vison d'Amérique,,American Mink,,Vison vison,Mustela vison,,Indigène,Régulier,Confirmé,Toute l'année,Mammalia,Carnivora,Mustelidae,Vison,vison,,S5,Non suivie,Québec
801,Mammifères,Carcajou,"carcajou, pop. de l'Est; diable des bois;glouton",Wolverine,Glutton; Skunk Bear,Gulo gulo,,,Indigène,Régulier,Confirmé,Inconnu/non déterminé,Mammalia,Carnivora,Mustelidae,Gulo,gulo,,SH,Menacée,Québec
803,Mammifères,Mouffette rayée,bête puante,Striped Skunk,,Mephitis mephitis,,,Indigène,Régulier,Confirmé,Toute l'année,Mammalia,Carnivora,Mephitidae,Mephitis,mephitis,,S5,Non suivie,Québec
804,Mammifères,Loutre de rivière,loutre du Canada,North American River Otter,,Lontra canadensis,Lutra canadensis,,Indigène,Régulier,Confirmé,Toute l'année,Mammalia,Carnivora,Mustelidae,Lontra,canadensis,,S5,Non suivie,Québec
805,Mammifères,Phoque commun,phoque veau marin; loup-marin,Harbor Seal,,Phoca vitulina,,,Indigène,Régulier,Confirmé,Toute l'année,Mammalia,Carnivora,Phocidae,Phoca,vitulina,,SNA,Non suivie,Pêches et Océans Canada
807,Mammifères,Phoque commun des lacs des Loups Marins,phoque d'eau douce; achikunipi,Harbour Seal - Lac des Loups Marins subspecies,Ungava Seal,Phoca vitulina mellonae,,,Indigène,Régulier,Confirmé,Toute l'année,Mammalia,Carnivora,Phocidae,Phoca,vitulina,mellonae,S1,Susceptible,Pêches et Océans Canada
808,Mammifères,Phoque du Groenland,loup-marin de glace,Harp Seal,,Pagophilus groenlandicus,Phoca groenlandica,,Indigène,Régulier,Confirmé,Toute l'année,Mammalia,Carnivora,Phocidae,Pagophilus,groenlandicus,,S5,Non suivie,Pêches et Océans Canada
809,Mammifères,Phoque annelé,,Ringed Seal,,Pusa hispida,Phoca hispida,,Indigène,Régulier,Confirmé,Toute l'année,Mammalia,Carnivora,Phocidae,Pusa,hispida,,S5,Non suivie,Pêches et Océans Canada
810,Mammifères,Phoque barbu,,Bearded Seal,,Erignathus barbatus,,,Indigène,Régulier,Confirmé,Toute l'année,Mammalia,Carnivora,Phocidae,Erignathus,barbatus,,S4,Non suivie,Pêches et Océans Canada
811,Mammifères,Phoque gris,tête de cheval,Gray Seal,,Halichoerus grypus,,,Indigène,Régulier,Confirmé,Toute l'année,Mammalia,Carnivora,Phocidae,Halichoerus,grypus,,S5,Non suivie,Pêches et Océans Canada
812,Mammifères,Phoque à capuchon,phoque à crête; dos-bleu,Hooded Seal,,Cystophora cristata,,,Indigène,Régulier,Confirmé,Toute l'année,Mammalia,Carnivora,Phocidae,Cystophora,cristata,,S5,Non suivie,Pêches et Océans Canada
813,Mammifères,Cougar,"COSEPAC: couguar, pop. de l'Est; puma; lion de montagne",Cougar,Mountain Lion; Panther,Puma concolor,Felis concolor,"Officiellement, le dernier cougar a été abattu au Québec en 1938, mais un animal abattu en 1992 en Abitibi provenait d'Amérique du Sud. Antérieurement, c'est le cougar de l'Est qui était présent au Québec. Cependant, les dernières analyses génétiques réalisées ont démontré qu'il ne s'agissait plus du cougar de l'Est.",Indigène,Inconnu/non déterminé,Confirmé,Inconnu/non déterminé,Mammalia,Carnivora,Felidae,Puma,concolor,,SU,Susceptible,Québec
816,Mammifères,Lynx du Canada,loup-cervier,Canadian Lynx,Canada Lynx,Lynx canadensis,,,Indigène,Régulier,Confirmé,Toute l'année,Mammalia,Carnivora,Felidae,Lynx,canadensis,,S5,Retirée,Québec
817,Mammifères,Lynx roux,lynx bai,Bobcat,,Lynx rufus,,,Indigène,Régulier,Confirmé,Toute l'année,Mammalia,Carnivora,Felidae,Lynx,rufus,,S4,Retirée,Québec
819,Mammifères,Cerf de Virginie,chevreuil; chevreuil de Virginie; cariacou,White-tailed Deer,,Odocoileus virginianus,,,Indigène,Régulier,Confirmé,Toute l'année,Mammalia,Artiodactyla,Cervidae,Odocoileus,virginianus,,S5,Non suivie,Québec
820,Mammifères,Orignal,élan d'Amérique,Moose,,Alces alces,Alces americanus,,Indigène,Régulier,Confirmé,Toute l'année,Mammalia,Artiodactyla,Cervidae,Alces,alces,,S5,Non suivie,Québec
822,Mammifères,"Caribou des bois, écotype montagnard, pop. de la Gaspésie","caribou montagnard - pop. Gaspésie; caribou, pop. De la Gaspésie-Atlantique",Woodland Caribou - Mountain ecotype - Gaspésie population,,Rangifer tarandus caribou pop. 2,"caribou des bois, pop de la Gaspésie-Atlantique; Unité désignable #11 (UD-11)",La population de la Gaspésie appartiend à l'écotype montagnard.,Indigène,Régulier,Confirmé,Toute l'année,Mammalia,Artiodactyla,Cervidae,Rangifer,tarandus,caribou pop. 2,S1,Menacée,Québec
827,Mammifères,"Caribou des bois, écotype migrateur, pop. de la rivière George","caribou toundrique; caribou des bois, écotype toundrique; caribou migrateur de l'Est",Woodland Caribou - Migratory ecotype - George River population,,Rangifer tarandus caribou pop. 7,,,Indigène,Régulier,Confirmé,Toute l'année,Mammalia,Artiodactyla,Cervidae,Rangifer,tarandus,caribou pop. 7,S1S2,Non suivie,Québec
828,Mammifères,Boeuf musqué,ovibos,Muskox,,Ovibos moschatus,,"Après son introduction, cette espèce s'est acclimatée dans l'extrême Nord du Québec.",Exotique,Régulier,Confirmé,Toute l'année,Mammalia,Artiodactyla,Bovidae,Ovibos,moschatus,,SNA,Non suivie,Québec
829,Reptiles,Tortue serpentine,chélydre serpentine; tortue happante; tortue de terre,Snapping Turtle,Snapping Turtle; Snake Tortoise,Chelydra serpentina,,,Indigène,Régulier,Confirmé,Toute l'année,Reptilia,Testudines,Chelydridae,Chelydra,serpentina,,S4,Candidate,Québec
830,Reptiles,Tortue luth,,Leatherback Sea Turtle,Atlantic Leatherback Turtle; Leatherback,Dermochelys coriacea,,,Indigène,Régulier,Confirmé,Non reproducteur,Reptilia,Testudines,Dermochelyidae,Dermochelys,coriacea,,SNA,Menacée,Pêches et Océans Canada
831,Reptiles,Tortue peinte,tortue peinte du Centre; emyde peinte,Painted Turtle,Midland Painted Turtle; Central Painted Turtle; Northern Painted Turtle,Chrysemys picta,,"Il est possible que seule la sous-espèce C. p. marginata soit présente au Québec. Le nom français de cette sous-espèce est ""tortue peinte du Centre"" et le nom anglais est ""Midland Painted Turtle"".",Indigène,Régulier,Confirmé,Toute l'année,Reptilia,Testudines,Emydidae,Chrysemys,picta,,S4,Non suivie,Québec
832,Reptiles,Tortue ponctuée,emyde tachetée,Spotted Turtle,,Clemmys guttata,,,Indigène,Inconnu/non déterminé,"Rapporté, non confirmé",Non reproducteur,Reptilia,Testudines,Emydidae,Clemmys,guttata,,SNA,Susceptible,Québec
833,Reptiles,Tortue des bois,,Wood Turtle,Wood Tortoise,Glyptemys insculpta,Clemmys insculpta,,Indigène,Régulier,Confirmé,Toute l'année,Reptilia,Testudines,Emydidae,Glyptemys,insculpta,,S3,Vulnérable,Québec
834,Reptiles,Tortue mouchetée,"tortue mouchetée, pop. des Grands-Lacs et du Saint-Laurent; tortue de blanding",Blanding's Turtle,,Emydoidea blandingii,Emys blandingii,,Indigène,Régulier,Confirmé,Toute l'année,Reptilia,Testudines,Emydidae,Emydoidea,blandingii,,S2S3,Menacée,Québec
835,Reptiles,Tortue géographique,tortue géographique du Nord,Northern Map Turtle,Common Map Turtle; Map Turtle,Graptemys geographica,,"Le nom français ""tortue géographique"" et le nom anglais ""Map Turtle"" sont associés au genre Graptemys et ne sont pas assez précis pour désigner l'espèce. Toutefois, le statut d'espèce vulnérable a été attribué au nom français simplifié ""tortue géographique"" et non à son nom précis ""tortue géographique du Nord"".",Indigène,Régulier,Confirmé,Toute l'année,Reptilia,Testudines,Emydidae,Graptemys,geographica,,S2S3,Vulnérable,Québec
837,Reptiles,Tortue à oreilles rouges,,Red-eared Slider,Slider,Trachemys scripta elegans,Chrysemys scripta,"Il s'agit d'une espèce exotique envahissante. Il est admis que seule la sous-espèce T. s. elegans soit présente au Québec. Le nom français de cette sous-espèce est ""tortue à oreilles rouges"" et le nom anglais est ""Red-eared Slider"", alors que le nom français de l'espèce est ""tortue glisseuse des étangs"" et le nom anglais est ""Pond Slider"".",Exotique,Régulier,Confirmé,Non reproducteur,Reptilia,Testudines,Emydidae,Trachemys,scripta,elegans,SNA,Non suivie,Québec
838,Reptiles,Tortue musquée,tortue musquée de l'Est,Eastern Musk Turtle,Common Musk Turtle,Sternotherus odoratus,,"Le nom français ""tortue musquée"" et le nom anglais ""Musk Turtle"" sont associés au genre Sternotherus et ne sont pas assez précis pour désigner l'espèce. Toutefois, le statut d'espèce menacée a été attribué au nom français simplifié ""tortue musquée"" et non à son nom précis ""tortue musquée de l'Est"".",Indigène,Régulier,Confirmé,Toute l'année,Reptilia,Testudines,Kinosternidae,Sternotherus,odoratus,,S2,Menacée,Québec
839,Reptiles,Tortue-molle à épines,"tortue molle à épines de l'Est, sous population des Grands Lacs et du Saint-Laurent; tortue à carapace molle",Spiny Softshell,Soft-Shelled Turtle; Northern Soft-shelled Turtle; Spiny Softshell,Apalone spinifera,,"Il est possible que seule la sous-espèce A. s. spinifera soit présente au Québec. Le nom français de cette sous-espèce est ""tortue molle à épines de l'Est"" et le nom anglais est ""Eastern Spiny Softshell"". Toutefois, le statut d'espèce menacée a été attribué à l'espèce et non à la sous-espèce (un trait d'union a aussi été indiqué dans le nom de l'espèce, bien que ce dernier soit souvent absent dans les ouvrages de référence).",Indigène,Régulier,Confirmé,Toute l'année,Reptilia,Testudines,Trionychidae,Apalone,spinifera,,S1,Menacée,Québec
843,Reptiles,Couleuvre tachetée,couleuvre annelée; ablabès triangle,Eastern Milksnake,Milksnake; Thunder Snake; Lightning Snake; House Snake,Lampropeltis triangulum,,"Il est possible que la sous-espèce L. t. triangulum ne soit plus reconnue. Auparavant, le nom officiel français de cette sous-espèce était ""couleuvre tachetée"" et le nom anglais était ""Eastern Milksnake"", de sorte que le nom français associé à l'espèce était ""couleuvre annelée"" et le nom anglais ""Milksnake"", le terme ""couleuvre tachetée"" étant alors associé à la sous-espèce ""L. t. triangulum"" seulement.",Indigène,Régulier,Confirmé,Toute l'année,Reptilia,Squamata,Colubridae,Lampropeltis,triangulum,,S3,Vulnérable,Québec
845,Reptiles,Couleuvre brune,couleuvre brune de Dekay; couleuvre brune du Nord,Dekay’s Brownsnake,Brownsnake; Northern Brown Snake; Midland Brown Snake,Storeria dekayi,,"Le nom français ""couleuvre brune"" et le nom anglais ""Brownsnake"" sont associés au genre Storeria et ne sont pas assez précis pour désigner l'espèce. Toutefois, l'inscription de cette espèce à la liste des espèces susceptibles d'être désignées comme menacées ou vulnérables a été attribué au nom français simplifié ""couleuvre brune"" et non à son nom précis ""couleuvre brune de Dekay"".",Indigène,Régulier,Confirmé,Toute l'année,Reptilia,Squamata,Colubridae,Storeria,dekayi,,S2,Menacée,Québec
846,Reptiles,Couleuvre à ventre rouge,tropidonote à cou taché; petit serpent brun,Red-bellied Snake,Spotted-neck Snake; Red Bellied Snake,Storeria occipitomaculata,,,Indigène,Régulier,Confirmé,Toute l'année,Reptilia,Squamata,Colubridae,Storeria,occipitomaculata,,S5,Non suivie,Québec
847,Reptiles,Couleuvre rayée,couleuvre rayée commune; couleuvre commune; couleuvre rayée de l'Est; couleuvre rayée des Maritimes,Common Gartersnake,Eastern Grater Snake; Maritime Grater Snake; Grass Snake; Striped Snake,Thamnophis sirtalis,,"Il est possible que l'espèce soit représentée par deux sous-espèces au Québec, soit la couleuvre rayée des Maritimes (T.s. pallidulus) et la couleuvre rayée de l'Est (T.s. sirtalis)",Indigène,Régulier,Confirmé,Toute l'année,Reptilia,Squamata,Colubridae,Thamnophis,sirtalis,,S5,Non suivie,Québec
848,Reptiles,Couleuvre verte,couleuvre verte lisse,Smooth Greensnake,Eastern Smooth Green Snake; Grass snake,Opheodrys vernalis,Liochlorophis vernalis,"Le nom français ""couleuvre verte"" et le nom anglais ""Greensnake"" sont associés au genre Opheodrys et ne sont pas assez précis pour désigner l'espèce. Toutefois, l'inscription de cette espèce à la liste des espèces susceptibles d'être désignées comme menacées ou vulnérables a été attribué au nom français simplifié ""couleuvre verte"" et non à son nom précis ""couleuvre verte lisse"".",Indigène,Régulier,Confirmé,Toute l'année,Reptilia,Squamata,Colubridae,Opheodrys,vernalis,,S3S4,Susceptible,Québec
6786,Mammifères,"Caribou des bois, écotype forestier",caribou des bois - population boréale; caribou boréal,Woodland Caribou - Woodland Ecotype,Woodland Caribou - Boreal ecotype,Rangifer tarandus caribou pop. 14,,,Indigène,Régulier,Confirmé,Toute l'année,Mammalia,Artiodactyla,Cervidae,Rangifer,tarandus,caribou pop. 14,S2S3,Vulnérable,Québec
30255,Poissons,Myxine de Girard,myxine de l’Atlantique Ouest,Girard's Hagfish,Western Atlantic Hagfish,Myxine limosa,,,Indigène,Régulier,Confirmé,Toute l'année,Myxini,Myxiniformes,Myxinidae,Myxine,limosa,,S5,Non suivie,Pêches et Océans Canada
577,Poissons,Naseux des rapides,goujon à long nez des Grands Lacs; goujon à long nez,Longnose Dace,Long-nose Dace; Long-nosed Dace; Great Lakes Longnose Dace,Rhinichthys cataractae,,,Indigène,Régulier,Confirmé,Toute l'année,Actinopterygii,Cypriniformes,Leuciscidae,Rhinichthys,cataractae,,S5,Non suivie,Déléguée au Québec
576,Poissons,Naseux noir de l'Est,naseux noir; goujon à nez noir de l'Est,Blacknose Dace,Blacknose Dace; Strided Dace; Redfin Dace; Brook Minnow; Eastern Blacknose Dace;,Rhinichthys atratulus,,"Le nom commun français diffère de celui utilisé dans la publication ""American Fisheries Society (2013) Common and Scientific Names of Fishes from the United States, Canada, and Mexico, 7th edition"", mais sera révisé lors de la prochaine publication.",Indigène,Régulier,Confirmé,Toute l'année,Actinopterygii,Cypriniformes,Leuciscidae,Rhinichthys,atratulus,,S5,Non suivie,Déléguée au Québec
30220,Poissons,Ogre,,Fangtooth,,Anoplogaster cornuta,,,Indigène,Accidentel/non régulier,Confirmé,Non reproducteur,Actinopterygii,Trachichthyiformes,Anoplogastridae,Anoplogaster,cornuta,,SNA,Non suivie,Pêches et Océans Canada
540,Poissons,Omble chevalier,truite rouge; omble rouge du Québec,Arctic Char,Red Charr; Hearne's Salmon; Hudson Bay Salmon; Eqaluk,Salvelinus alpinus,Salvelinus salvelinus,,Indigène,Régulier,Confirmé,Toute l'année,Actinopterygii,Salmoniformes,Salmonidae,Salvelinus,alpinus,,S4,Non suivie,Déléguée au Québec
14059,Poissons,Omble chevalier oquassa,oquassa,Arctic Char oquassa,Landlocked Arctic Char,Salvelinus alpinus oquassa,,Toutes les populations isolées en eau douce de l'omble chevalier (Salvelinus alpinus) appartiennent à la sous-espèce Salvelinus alpinus oquassa.,Indigène,Régulier,Confirmé,Toute l'année,Actinopterygii,Salmoniformes,Salmonidae,Salvelinus,alpinus,oquassa,S2S3,Vulnérable,Déléguée au Québec
14446,Oiseaux,Ibis à face blanche,,White-faced Ibis,,Plegadis chihi,,,Indigène,Accidentel/non régulier,Confirmé,Migrateur,Aves,Pelecaniformes,Threskiornithidae,Plegadis,chihi,,SNA,Non suivie,Environnement et Changement climatique Canada
14447,Oiseaux,Bernache de Hutchins,,Cackling Goose,,Branta hutchinsii,,,Indigène,Régulier,Confirmé,Reproducteur,Aves,Anseriformes,Anatidae,Branta,hutchinsii,,S3B,Non suivie,Environnement et Changement climatique Canada
14449,Oiseaux,Milan du Mississippi,,Mississippi Kite,,Ictinia mississippiensis,,,Indigène,Accidentel/non régulier,Confirmé,Migrateur,Aves,Accipitriformes,Accipitridae,Ictinia,mississippiensis,,SNA,Non suivie,Québec
14451,Oiseaux,Râle tapageur,râle gris,Clapper Rail,,Rallus crepitans,,,Indigène,Accidentel/non régulier,Confirmé,Migrateur,Aves,Gruiformes,Rallidae,Rallus,crepitans,,SNA,Non suivie,Environnement et Changement climatique Canada
14452,Oiseaux,Grue blanche,,Whooping Crane,,Grus americana,,,Indigène,Accidentel/non régulier,Confirmé,Migrateur,Aves,Gruiformes,Gruidae,Grus,americana,,SNA,Non suivie,Environnement et Changement climatique Canada
14453,Oiseaux,Courlis cendré,,Eurasian Curlew,,Numenius arquata,,,Indigène,Accidentel/non régulier,Confirmé,Migrateur,Aves,Charadriiformes,Scolopacidae,Numenius,arquata,,SNA,Non suivie,
14454,Oiseaux,Bécasseau à col roux,,Red-necked Stint,,Calidris ruficollis,,,Indigène,Accidentel/non régulier,Confirmé,Migrateur,Aves,Charadriiformes,Scolopacidae,Calidris,ruficollis,,SNA,Non suivie,Environnement et Changement climatique Canada
14455,Oiseaux,Sterne hansel,,Gull-billed Tern,,Gelochelidon nilotica,,,Indigène,Accidentel/non régulier,Confirmé,Migrateur,Aves,Charadriiformes,Laridae,Gelochelidon,nilotica,,SNA,Non suivie,Environnement et Changement climatique Canada
14456,Oiseaux,Pigeon à queue barrée,,Band-tailed Pigeon,,Patagioenas fasciata,,,Indigène,Accidentel/non régulier,Confirmé,Migrateur,Aves,Columbiformes,Columbidae,Patagioenas,fasciata,,SNA,Non suivie,Environnement et Changement climatique Canada
14459,Oiseaux,Colibri roux,,Rufous Hummingbird,,Selasphorus rufus,,,Indigène,Accidentel/non régulier,Confirmé,Migrateur,Aves,Apodiformes,Trochilidae,Selasphorus,rufus,,SNA,Non suivie,Environnement et Changement climatique Canada
14460,Oiseaux,Pioui de l'Ouest,,Western Wood-Pewee,,Contopus sordidulus,,,Indigène,Accidentel/non régulier,Confirmé,Migrateur,Aves,Passeriformes,Tyrannidae,Contopus,sordidulus,,SNA,Non suivie,Environnement et Changement climatique Canada
